Section,Division,Group,Class,Activity,ISICRev. 4
,,88.1,,Social work activities without accommodation for the elderly and disabled,
,,,88.10,Social work activities without accommodation for the elderly and disabled,8810
,,88.9,,Other social work activities without accommodation,
,,,88.91,Child day-care activities,8890*
,,,88.99,Other social work activities without accommodation n.e.c.,8890*
R,,,,"Arts, Entertainment And Recreation",
,90,,,"Creative, arts and entertainment activities",
,,90.0,,"Creative, arts and entertainment activities",
,,,90.01,Performing arts,9000*
,,,90.02,Support activities to performing arts,9000*
,,,90.03,Artistic creation,9000*
,,,90.04,Operation of arts facilities,9000*
,91,,,"Libraries, archives, museums and other cultural activities",
,,91.0,,"Libraries, archives, museums and other cultural activities",
,,,91.01,Library and archives activities,9101
,,,91.02,Museums activities,9102*
,,,91.03,Operation of historical sites and buildings and similar visitor attractions,9102*
,,,91.04,Botanical and zoological gardens and nature reserves activities,9103
,92,,,Gambling and betting activities,
,,92.0,,Gambling and betting activities,
,,,92.00,Gambling and betting activities,9200
,93,,,Sports activities and amusement and recreation activities,
,,93.1,,Sports activities,
,,,93.11,Operation of sports facilities,9311*
,,,93.12,Activities of sport clubs,9312
,,,93.13,Fitness facilities,9311*
,,,93.19,Other sports activities,9319
,,93.2,,Amusement and recreation activities,
,,,93.21,Activities of amusement parks and theme parks,9321
,,,93.29,Other amusement and recreation activities,9329
S,,,,Other Service Activities,
,94,,,Activities of membership organisations,
,,94.1,,"Activities of business, employers and professional membership organisations",
,,,94.11,Activities of business and employers membership organisations,9411
,,,94.12,Activities of professional membership organisations,9412
,,94.2,,Activities of trade unions,
,,,94.20,Activities of trade unions,9420
,,94.9,,Activities of other membership organisations,
,,,94.91,Activities of religious organisations,9491
,,,94.92,Activities of political organisations,9492
,,,94.99,Activities of other membership organisations n.e.c.,9499
,95,,,Repair of computers and personal and household goods,
,,95.1,,Repair of computers and communication equipment,
,,,95.11,Repair of computers and peripheral equipment,9511
,,,95.12,Repair of communication equipment,9512
,,95.2,,Repair of personal and household goods,
,,,95.21,Repair of consumer electronics,9521
,,,95.22,Repair of household appliances and home and garden equipment,9522
,,,95.23,Repair of footwear and leather goods,9523
,,,95.24,Repair of furniture and home furnishings,9524
,,,95.25,"Repair of watches, clocks and jewellery",9529*
,,,95.29,Repair of other personal and household goods,9529*
,96,,,Other personal service activities,
,,96.0,,Other personal service activities,
,,,96.01,Washing and (dry-)cleaning of textile and fur products,9601
,,,96.02,Hairdressing and other beauty treatment,9602
,,,96.03,Funeral and related activities,9603
,,,96.04,Physical well-being activities,9609*
,,,96.09,Other personal service activities n.e.c.,9609*
T,,,,"Activities Of Households As Employers; Undifferentiated Goods- And Services-producing  
Activities Of Households For Own Use",
,97,,,Activities of households as employers of domestic personnel,
,,97.0,,Activities of households as employers of domestic personnel,
,,,97.00,Activities of households as employers of domestic personnel,9700
,98,,,Undifferentiated goods- and services-producing activities of private households for own use,
,,98.1,,Undifferentiated goods-producing activities of private households for own use,
,,,98.10,Undifferentiated goods-producing activities of private households for own use,9810
,,98.2,,Undifferentiated service-producing activities of private households for own use,
,,,98.20,Undifferentiated service-producing activities of private households for own use,9820
U,,,,Activities Of Extraterritorial Organisations And Bodies,
,99,,,Activities of extraterritorial organisations and bodies,
,,99.0,,Activities of extraterritorial organisations and bodies,
,,,99.00,Activities of extraterritorial organisations and bodies,9900
